{
  "schema_version": "1.0",
  "product_id": "prod_us_001",
  "seller_account_id": "seller_primary_us",
  "marketplace_id": "ATVPDKIKX0DER",
  "asin": "B0EXAMPLE01",
  "sku": "SKU-CROCHET-001",
  "fnsku": null,
  "parent_asin": "B0PARENT001",
  "parent_product_id": null,
  "variation_family_id": "vf_crochet_001",
  "product_name": "Light Up Crochet Hook Set",
  "identity_status": "active",
  "source_refs": [
    "source:manual-bootstrap"
  ],
  "created_at": "2026-08-30T03:50:00Z",
  "updated_at": "2026-08-30T03:50:00Z",
  "metadata": {
    "note": "静态示例，仅用于Contract验收，不代表真实ASIN或真实Seller数据。"
  }
}
